,Locationabbr,Locationdesc,GeoLocation,Simpledesc
227,43780,"South Bend-Mishawaka, IN-MI Metropolitan Statistical Area","(41.672515, -86.253312)","South Bend-Mishawaka, IN-MI "
228,43900,"Spartanburg, SC Metropolitan Statistical Area","(34.9332324, -81.9910494)","Spartanburg, SC "
229,43940,"Spearfish, SD Micropolitan Statistical Area","(44.3536619, -103.7965179)","Spearfish, SD "
230,44060,"Spokane-Spokane Valley, WA Metropolitan Statistical Area","(47.6203691, -117.4033574)","Spokane-Spokane Valley, WA "
231,44140,"Springfield, MA Metropolitan Statistical Area","(42.3644217, -72.6169632)","Springfield, MA "
232,45060,"Syracuse, NY Metropolitan Statistical Area","(43.05028, -76.14738)","Syracuse, NY "
233,45104,"Tacoma-Lakewood, WA Metropolitan Division","(47.0514309, -122.1532138)","Tacoma-Lakewood, WA "
234,45220,"Tallahassee, FL Metropolitan Statistical Area","(30.3866075, -84.2805102)","Tallahassee, FL "
235,45300,"Tampa-St. Petersburg-Clearwater, FL Metropolitan Statistical Area","(28.1259019, -82.4652824)","Tampa-St. Petersburg-Clearwater, FL "
236,45780,"Toledo, OH Metropolitan Statistical Area","(41.5551736, -83.5171522)","Toledo, OH "
237,45820,"Topeka, KS Metropolitan Statistical Area","(39.0413819, -95.8026315)","Topeka, KS "
238,45860,"Torrington, CT Micropolitan Statistical Area","(41.727851, -73.187494)","Torrington, CT "
239,45940,"Trenton, NJ Metropolitan Statistical Area","(40.2824946, -74.7037224)","Trenton, NJ "
240,46060,"Tucson, AZ Metropolitan Statistical Area","(32.1282325, -111.7830068)","Tucson, AZ "
241,46140,"Tulsa, OK Metropolitan Statistical Area","(36.2487143, -96.1638793)","Tulsa, OK "
242,46220,"Tuscaloosa, AL Metropolitan Statistical Area","(33.0571499, -87.6621373)","Tuscaloosa, AL "
243,46340,"Tyler, TX Metropolitan Statistical Area","(32.3770868, -95.2696225)","Tyler, TX "
244,46520,"Urban Honolulu, HI Metropolitan Statistical Area","(27.606, -105.718)","Urban Honolulu, HI "
245,46540,"Utica-Rome, NY Metropolitan Statistical Area","(43.09589, -75.24258)","Utica-Rome, NY "
246,47220,"Vineland-Bridgeton, NJ Metropolitan Statistical Area","(39.428284, -75.087728)","Vineland-Bridgeton, NJ "
247,47260,"Virginia Beach-Norfolk-Newport News, VA-NC Metropolitan Statistical Area","(36.9178599, -76.3705891)","Virginia Beach-Norfolk-Newport News, VA-NC "
248,47644,"Warren-Troy Farmington Hills, MI Metropolitan Division (2011 and prior)","(42.6604436, -83.3842058)","Warren-Troy Farmington Hills, MI  (2011 and prior)"
249,47664,"Warren-Troy Farmington Hills, MI Metropolitan Division (2012 to present)","(42.58689, -82.957388)","Warren-Troy Farmington Hills, MI  (2012 to present)"
250,47894,"Washington-Arlington-Alexandria, DC-VA-MD-WV Metropolitan Division","(38.7286117, -77.3983938)","Washington-Arlington-Alexandria, DC-VA-MD-WV "
251,47980,"Watertown, SD Micropolitan Statistical Area","(44.8524009, -97.1770906)","Watertown, SD "
252,48620,"Wichita, KS Metropolitan Statistical Area","(37.6385773, -97.2460297)","Wichita, KS "
253,48660,"Wichita Falls, TX Metropolitan Statistical Area","(33.774765, -98.491401)","Wichita Falls, TX "
254,48864,"Wilmington, DE-MD-NJ Metropolitan Division","(39.5724155, -75.6592128)","Wilmington, DE-MD-NJ "
255,49180,"Winston-Salem, NC Metropolitan Statistical Area","(36.1851701892101, -80.3969333654768)","Winston-Salem, NC "
256,49340,"Worcester, MA-CT Metropolitan Statistical Area","(42.3116848, -71.9402811)","Worcester, MA-CT "
257,49420,"Yakima, WA Metropolitan Statistical Area","(46.456846, -120.738703)","Yakima, WA "
258,49660,"Youngstown-Warren-Boardman, OH-PA Metropolitan Statistical Area","(41.2362934, -80.5618643)","Youngstown-Warren-Boardman, OH-PA "
