,Locationabbr,Locationdesc,GeoLocation,Simpledesc
0,10020,"Abbeville, LA Micropolitan Statistical Area","(29.7868663, -92.290084)","Abbeville, LA "
1,10100,"Aberdeen, SD Micropolitan Statistical Area","(45.5222131, -98.7041456)","Aberdeen, SD "
2,10380,"Aguadilla-Isabela, PR Metropolitan Statistical Area","(20.795, -67.847)","Aguadilla-Isabela, PR "
3,10420,"Akron, OH Metropolitan Statistical Area","(41.1466315, -81.3501066)","Akron, OH "
4,10580,"Albany-Schenectady-Troy, NY Metropolitan Statistical Area","(42.65244, -73.76085)","Albany-Schenectady-Troy, NY "
5,10740,"Albuquerque, NM Metropolitan Statistical Area","(35.1165976, -106.4565247)","Albuquerque, NM "
6,10900,"Allentown-Bethlehem-Easton, PA-NJ Metropolitan Statistical Area","(40.7892985, -75.3983269)","Allentown-Bethlehem-Easton, PA-NJ "
7,11244,"Los Angeles-Long Beach-Anaheim, CA Metropolitan Division","(34.065193, -118.244222)","Los Angeles-Long Beach-Anaheim, CA "
8,11260,"Anchorage, AK Metropolitan Statistical Area","(26.936, -114.896)","Anchorage, AK "
9,11700,"Asheville, NC Metropolitan Statistical Area","(35.5956625, -82.6816107)","Asheville, NC "
10,12060,"Atlanta-Sandy Springs-Roswell, GA Metropolitan Statistical Area","(33.6952845, -84.4389383)","Atlanta-Sandy Springs-Roswell, GA "
11,12100,"Atlantic City-Hammonton, NJ Metropolitan Statistical Area","(39.469346, -74.6337568)","Atlantic City-Hammonton, NJ "
12,12260,"Augusta-Richmond County, GA-SC Metropolitan Statistical Area","(33.4372136, -81.9561532)","Augusta-Richmond County, GA-SC "
13,12300,"Augusta-Waterville, ME Micropolitan Statistical Area","(44.4170028, -69.7657636)","Augusta-Waterville, ME "
14,12420,"Austin-Round Rock, TX Metropolitan Statistical Area","(30.2395076, -97.6912621)","Austin-Round Rock, TX "
15,12580,"Baltimore-Columbia-Towson, MD Metropolitan Statistical Area","(39.3043531, -76.5494987)","Baltimore-Columbia-Towson, MD "
16,12620,"Bangor, ME Metropolitan Statistical Area","(45.3905929, -68.6574869)","Bangor, ME "
17,12700,"Barnstable Town, MA Metropolitan Statistical Area","(41.7988102, -70.2110824)","Barnstable Town, MA "
18,12740,"Barre, VT Micropolitan Statistical Area","(44.2749442, -72.6094737)","Barre, VT "
19,12940,"Baton Rouge, LA Metropolitan Statistical Area","(30.5708797, -91.1346142)","Baton Rouge, LA "
20,13220,"Beckley, WV Metropolitan Statistical Area","(37.77759, -81.18764)","Beckley, WV "
21,13380,"Bellingham, WA Metropolitan Statistical Area","(48.8255705174443, -121.704252228333)","Bellingham, WA "
22,13620,"Berlin, NH-VT Micropolitan Statistical Area","(44.6998938928246, -71.4215970275854)","Berlin, NH-VT "
23,13644,"Bethesda-Rockville-Frederick, MD Metropolitan Division","(39.3321125, -77.3162122)","Bethesda-Rockville-Frederick, MD "
24,13740,"Billings, MT Metropolitan Statistical Area","(45.6424248, -108.599649)","Billings, MT "
25,13780,"Binghamton, NY Metropolitan Statistical Area","(42.09869, -75.91136)","Binghamton, NY "
26,13820,"Birmingham-Hoover, AL Metropolitan Statistical Area","(33.4623655, -86.8143329)","Birmingham-Hoover, AL "
27,13900,"Bismarck, ND Metropolitan Statistical Area","(46.8373476, -100.9054398)","Bismarck, ND "
28,14260,"Boise City, ID Metropolitan Statistical Area","(43.0066426, -116.141896)","Boise City, ID "
29,14454,"Boston, MA Metropolitan Division","(-70.8754256, 42.0625412)","Boston, MA "
30,14484,"Boston-Quincy, MA Metropolitan Division","(42.0625412, -70.8754256)","Boston-Quincy, MA "
31,14500,"Boulder, CO Metropolitan Statistical Area","(40.0948313, -105.3983667)","Boulder, CO "
32,14580,"Bozeman, MT Micropolitan Statistical Area","(45.535552, -111.1734307)","Bozeman, MT "
33,14740,"Bremerton-Silverdale, WA Metropolitan Statistical Area","(47.639831, -122.648996)","Bremerton-Silverdale, WA "
34,14860,"Bridgeport-Stamford-Norwalk, CT Metropolitan Statistical Area","(41.2274401, -73.3664694)","Bridgeport-Stamford-Norwalk, CT "
35,15100,"Brookings, SD Micropolitan Statistical Area","(44.3766668, -96.7977884)","Brookings, SD "
36,15380,"Buffalo-Cheektowaga-Niagara Falls, NY Metropolitan Statistical Area","(43.0443626, -78.777332)","Buffalo-Cheektowaga-Niagara Falls, NY "
37,15540,"Burlington-South Burlington, VT Metropolitan Statistical Area","(44.6891078, -73.0411693)","Burlington-South Burlington, VT "
38,15764,"Cambridge-Newton-Framingham, MA Metropolitan Division","(42.4794683, -71.3965063)","Cambridge-Newton-Framingham, MA "
39,15804,"Camden, NJ Metropolitan Division","(39.8098807, -74.8232086)","Camden, NJ "
40,15940,"Canton-Massillon, OH Metropolitan Statistical Area","(40.7110642, -81.2614706)","Canton-Massillon, OH "
41,16220,"Casper, WY Metropolitan Statistical Area","(42.9736335, -106.7648661)","Casper, WY "
42,16300,"Cedar Rapids, IA Metropolitan Statistical Area","(42.0855843, -91.6304636)","Cedar Rapids, IA "
43,16620,"Charleston, WV Metropolitan Statistical Area","(38.2894939, -81.6598481)","Charleston, WV "
44,16700,"Charleston-North Charleston, SC Metropolitan Statistical Area","(33.0153769, -80.0107744)","Charleston-North Charleston, SC "
45,16740,"Charlotte-Concord-Gastonia, NC-SC Metropolitan Statistical Area","(35.1091293, -80.7322679)","Charlotte-Concord-Gastonia, NC-SC "
46,16860,"Chattanooga, TN-GA Metropolitan Statistical Area","(35.0489417, -85.3619225)","Chattanooga, TN-GA "
47,16940,"Cheyenne, WY Metropolitan Statistical Area","(41.2928235, -104.6603848)","Cheyenne, WY "
48,16980,"Chicago-Naperville-Elgin, IL-IN-WI Metropolitan Statistical Area","(41.8235136, -87.8282909)","Chicago-Naperville-Elgin, IL-IN-WI "
49,17140,"Cincinnati, OH-KY-IN Metropolitan Statistical Area","(39.0785757, -84.4635032)","Cincinnati, OH-KY-IN "
50,17200,"Claremont-Lebanon, NH-VT Micropolitan Statistical Area","(43.838874, -71.953268)","Claremont-Lebanon, NH-VT "
51,17460,"Cleveland-Elyria, OH Metropolitan Statistical Area","(41.7603839, -81.7242128)","Cleveland-Elyria, OH "
52,17780,"College Station-Bryan, TX Metropolitan Statistical Area","(30.62816, -96.33712)","College Station-Bryan, TX "
53,17820,"Colorado Springs, CO Metropolitan Statistical Area","(38.8454601, -104.6390585)","Colorado Springs, CO "
54,17900,"Columbia, SC Metropolitan Statistical Area","(34.0841683, -81.0405942)","Columbia, SC "
55,18100,"Columbus, NE Micropolitan Statistical Area","(41.5768583, -97.5134588)","Columbus, NE "
56,18140,"Columbus, OH Metropolitan Statistical Area","(40.0399613, -82.9364058)","Columbus, OH "
57,18180,"Concord, NH Micropolitan Statistical Area","(43.2994761, -71.6801286)","Concord, NH "
58,18580,"Corpus Christi, TX Metropolitan Statistical Area","(27.76688, -97.40815)","Corpus Christi, TX "
59,18880,"Crestview-Fort Walton Beach-Destin, FL Metropolitan Statistical Area","(30.76183, -86.57102)","Crestview-Fort Walton Beach-Destin, FL "
60,19060,"Cumberland, MD-WV Metropolitan Statistical Area","(39.65177, -78.76333)","Cumberland, MD-WV "
61,19124,"Dallas-Plano-Irving, TX Metropolitan Division","(32.8993882, -96.5709024)","Dallas-Plano-Irving, TX "
62,19340,"Davenport-Moline-Rock Island, IA-IL Metropolitan Statistical Area","(41.3916723, -90.4600695)","Davenport-Moline-Rock Island, IA-IL "
63,19380,"Dayton, OH Metropolitan Statistical Area","(39.8060029, -84.268051)","Dayton, OH "
64,19660,"Deltona-Daytona Beach-Ormond Beach, FL Metropolitan Statistical Area","(29.063452, -81.148572)","Deltona-Daytona Beach-Ormond Beach, FL "
65,19740,"Denver-Aurora-Lakewood, CO Metropolitan Statistical Area","(39.4342749, -104.9023591)","Denver-Aurora-Lakewood, CO "
66,19780,"Des Moines-West Des Moines, IA Metropolitan Statistical Area","(41.5449189, -93.9434432)","Des Moines-West Des Moines, IA "
67,19804,"Detroit-Dearborn-Livonia, MI Metropolitan Division","(42.2846554, -83.2619488)","Detroit-Dearborn-Livonia, MI "
68,20100,"Dover, DE Metropolitan Statistical Area","(39.0970805, -75.5029801)","Dover, DE "
69,20260,"Duluth, MN-WI Metropolitan Statistical Area","(47.3297387, -92.376471)","Duluth, MN-WI "
70,20500,"Durham-Chapel Hill, NC Metropolitan Statistical Area","(35.9955289, -79.0969869)","Durham-Chapel Hill, NC "
71,20524,"Dutchess County-Putnam County, NY Metropolitan Division","(41.76569, -73.74322)","Dutchess County-Putnam County, NY "
72,20764,"Edison-New Brunswick, NJ Metropolitan Division","(40.1756937, -74.2974519)","Edison-New Brunswick, NJ "
73,21340,"El Paso, TX Metropolitan Statistical Area","(31.768551, -106.234829)","El Paso, TX "
74,21660,"Eugene, OR Metropolitan Statistical Area","(43.928271, -122.8976637)","Eugene, OR "
75,21780,"Evansville, IN-KY Metropolitan Statistical Area","(37.9790875, -87.5947741)","Evansville, IN-KY "
76,21820,"Fairbanks, AK Metropolitan Statistical Area","(28.263, -114.518)","Fairbanks, AK "
77,22020,"Fargo, ND-MN Metropolitan Statistical Area","(46.9156793, -96.9597002)","Fargo, ND-MN "
78,22140,"Farmington, NM Metropolitan Statistical Area","(36.5116187, -108.3245673)","Farmington, NM "
79,22180,"Fayetteville, NC Metropolitan Statistical Area","(35.0369365673829, -78.9803613354474)","Fayetteville, NC "
80,22220,"Fayetteville-Springdale-Rogers, AR-MO Metropolitan Statistical Area","(36.1976261, -94.1198896)","Fayetteville-Springdale-Rogers, AR-MO "
81,22500,"Florence, SC Metropolitan Statistical Area","(34.100049, -79.760954)","Florence, SC "
82,22660,"Fort Collins, CO Metropolitan Statistical Area","(40.6630847, -105.4821206)","Fort Collins, CO "
83,22900,"Fort Smith, AR-OK Metropolitan Statistical Area","(35.2402960277112, -94.4612129935184)","Fort Smith, AR-OK "
84,23060,"Fort Wayne, IN Metropolitan Statistical Area","(41.0069813, -85.2164004)","Fort Wayne, IN "
85,23104,"Fort Worth-Arlington, TX Metropolitan Division","(32.8073735, -97.537101)","Fort Worth-Arlington, TX "
86,23540,"Gainesville, FL Metropolitan Statistical Area","(29.688462, -82.476511)","Gainesville, FL "
87,24020,"Glens Falls, NY Metropolitan Statistical Area","(43.31122, -73.64376)","Glens Falls, NY "
88,24220,"Grand Forks, ND-MN Metropolitan Statistical Area","(47.92408, -97.03203)","Grand Forks, ND-MN "
89,24260,"Grand Island, NE Metropolitan Statistical Area","(41.0839187, -98.374209)","Grand Island, NE "
90,24340,"Grand Rapids-Wyoming, MI Metropolitan Statistical Area","(43.0726821, -85.4707757)","Grand Rapids-Wyoming, MI "
91,24500,"Great Falls, MT Metropolitan Statistical Area","(47.316436, -111.3505583)","Great Falls, MT "
92,24540,"Greeley, CO Metropolitan Statistical Area","(40.5557878, -104.3836386)","Greeley, CO "
93,24660,"Greensboro-High Point, NC Metropolitan Statistical Area","(36.0251968, -79.7926303)","Greensboro-High Point, NC "
94,24860,"Greenville-Anderson-Mauldin, SC Metropolitan Statistical Area","(34.7454455, -82.3258533)","Greenville-Anderson-Mauldin, SC "
95,25060,"Gulfport-Biloxi-Pascagoula, MS Metropolitan Statistical Area","(30.4876746, -89.1978019)","Gulfport-Biloxi-Pascagoula, MS "
96,25180,"Hagerstown-Martinsburg, MD-WV Metropolitan Statistical Area","(39.5543709, -77.9846143)","Hagerstown-Martinsburg, MD-WV "
97,25420,"Harrisburg-Carlisle, PA Metropolitan Statistical Area","(40.306988, -76.796622)","Harrisburg-Carlisle, PA "
98,25540,"Hartford-West Hartford-East Hartford, CT Metropolitan Statistical Area","(41.7185939, -72.573872)","Hartford-West Hartford-East Hartford, CT "
99,25580,"Hastings, NE Micropolitan Statistical Area","(40.5257154, -98.2748515)","Hastings, NE "
100,25660,"Havre, MT Micropolitan Statistical Area","(48.6319525, -110.1063082)","Havre, MT "
101,25720,"Heber, UT Micropolitan Statistical Area","(40.3348778, -111.1615568)","Heber, UT "
102,25740,"Helena, MT Micropolitan Statistical Area","(46.811347, -112.2840179)","Helena, MT "
103,25860,"Hickory-Lenoir-Morganton, NC Metropolitan Statistical Area","(35.8134326, -81.4552223)","Hickory-Lenoir-Morganton, NC "
104,25900,"Hilo, HI Micropolitan Statistical Area","(25.968, -103.006)","Hilo, HI "
105,25940,"Hilton Head Island-Bluffton-Beaufort, SC Metropolitan Statistical Area","(32.3867853, -80.8308744)","Hilton Head Island-Bluffton-Beaufort, SC "
106,26180,"Honolulu, HI Metropolitan Statistical Area","(27.606, -105.718)","Honolulu, HI "
107,26380,"Houma-Thibodaux, LA Metropolitan Statistical Area","(29.3332603, -90.8441847)","Houma-Thibodaux, LA "
108,26420,"Houston-The Woodlands-Sugar Land, TX Metropolitan Statistical Area","(29.8009994, -95.342613)","Houston-The Woodlands-Sugar Land, TX "
109,26580,"Huntington-Ashland, WV-KY-OH Metropolitan Statistical Area","(38.4080735, -82.5455054)","Huntington-Ashland, WV-KY-OH "
110,26620,"Huntsville, AL Metropolitan Statistical Area","(34.746392, -86.613232)","Huntsville, AL "
111,26820,"Idaho Falls, ID Metropolitan Statistical Area","(43.5457646, -111.8675825)","Idaho Falls, ID "
112,26900,"Indianapolis-Carmel-Anderson, IN Metropolitan Statistical Area","(39.699047, -86.2607787)","Indianapolis-Carmel-Anderson, IN "
113,27140,"Jackson, MS Metropolitan Statistical Area","(32.1895144, -90.187915)","Jackson, MS "
114,27260,"Jacksonville, FL Metropolitan Statistical Area","(30.2370003, -81.7552674)","Jacksonville, FL "
115,27980,"Kahului-Wailuku-Lahaina, HI Metropolitan Statistical Area","(27.077, -104.232)","Kahului-Wailuku-Lahaina, HI "
116,28060,"Kalispell, MT Micropolitan Statistical Area","(48.3146895, -114.0543053)","Kalispell, MT "
117,28140,"Kansas City, MO-KS Metropolitan Statistical Area","(38.9086579, -94.5086692)","Kansas City, MO-KS "
118,28180,"Kapaa, HI Micropolitan Statistical Area","(28.514, -107.221)","Kapaa, HI "
119,28260,"Kearney, NE Micropolitan Statistical Area","(40.7391376, -99.0315474)","Kearney, NE "
120,28300,"Keene, NH Micropolitan Statistical Area","(42.9254466, -72.2482159)","Keene, NH "
121,28420,"Kennewick-Richland, WA Metropolitan Statistical Area","(46.363538, -119.254308)","Kennewick-Richland, WA "
122,28700,"Kingsport-Bristol-Bristol, TN-VA Metropolitan Statistical Area","(36.6041558, -82.4401118)","Kingsport-Bristol-Bristol, TN-VA "
123,28940,"Knoxville, TN Metropolitan Statistical Area","(35.9294445, -84.0154928)","Knoxville, TN "
124,29060,"Laconia, NH Micropolitan Statistical Area","(43.5174, -71.44059)","Laconia, NH "
125,29180,"Lafayette, LA Metropolitan Statistical Area","(30.1524861, -91.7279009)","Lafayette, LA "
126,29340,"Lake Charles, LA Metropolitan Statistical Area","(29.9787494, -93.2532369)","Lake Charles, LA "
127,29620,"Lansing-East Lansing, MI Metropolitan Statistical Area","(42.7184273546504, -84.6094920076681)","Lansing-East Lansing, MI "
128,29740,"Las Cruces, NM Metropolitan Statistical Area","(32.3509067, -106.8321722)","Las Cruces, NM "
129,29820,"Las Vegas-Henderson-Paradise, NV Metropolitan Statistical Area","(36.2142307, -115.013807)","Las Vegas-Henderson-Paradise, NV "
130,29940,"Lawrence, KS Metropolitan Statistical Area","(38.8965657, -95.2905218)","Lawrence, KS "
131,30100,"Lebanon, NH-VT Micropolitan Statistical Area","(43.8542477, -72.1399456)","Lebanon, NH-VT "
132,30300,"Lewiston, ID-WA Metropolitan Statistical Area","(46.2516896, -116.925003)","Lewiston, ID-WA "
133,30340,"Lewiston-Auburn, ME Metropolitan Statistical Area","(44.1676721, -70.2074343)","Lewiston-Auburn, ME "
134,30460,"Lexington-Fayette, KY Metropolitan Statistical Area","(38.0913584, -84.43528)","Lexington-Fayette, KY "
135,30700,"Lincoln, NE Metropolitan Statistical Area","(40.8175087, -96.8687277)","Lincoln, NE "
136,30780,"Little Rock-North Little Rock-Conway, AR Metropolitan Statistical Area","(34.7558125, -92.4007259)","Little Rock-North Little Rock-Conway, AR "
137,30860,"Logan, UT-ID Metropolitan Statistical Area","(41.8839656, -111.7870808)","Logan, UT-ID "
138,31080,"Los Angeles-Long Beach-Anaheim, CA Metropolitan Statistical Area","(34.065193, -118.244222)","Los Angeles-Long Beach-Anaheim, CA "
139,31084,"Los Angeles-Long Beach-Glendale, CA Metropolitan Division","(34.1963934, -118.2618494)","Los Angeles-Long Beach-Glendale, CA "
140,31140,"Louisville/Jefferson County, KY-IN Metropolitan Statistical Area","(38.2395909, -85.6874952)","Louisville/Jefferson County, KY-IN "
141,31180,"Lubbock, TX Metropolitan Statistical Area","(33.6130861, -101.5481238)","Lubbock, TX "
142,31300,"Lumberton, NC Micropolitan Statistical Area","(34.674582, -79.093867)","Lumberton, NC "
143,31540,"Madison, WI Metropolitan Statistical Area","(43.06707, -89.40105)","Madison, WI "
144,31700,"Manchester-Nashua, NH Metropolitan Statistical Area","(42.9116341, -71.7231004)","Manchester-Nashua, NH "
145,31740,"Manhattan, KS Metropolitan Statistical Area","(39.2684172, -96.5622342)","Manhattan, KS "
146,32580,"McAllen-Edinburg-Mission, TX Metropolitan Statistical Area","(26.396721, -98.181071)","McAllen-Edinburg-Mission, TX "
147,32820,"Memphis, TN-MS-AR Metropolitan Statistical Area","(35.0244129, -89.8719654)","Memphis, TN-MS-AR "
148,33100,"Miami-Fort Lauderdale-West Palm Beach, FL Metropolitan Statistical Area","(26.1018233, -80.4787524)","Miami-Fort Lauderdale-West Palm Beach, FL "
149,33260,"Midland, TX Metropolitan Statistical Area","(31.8708904, -102.0243177)","Midland, TX "
150,33340,"Milwaukee-Waukesha-West Allis, WI Metropolitan Statistical Area","(43.0176465, -87.4815691)","Milwaukee-Waukesha-West Allis, WI "
151,33460,"Minneapolis-St. Paul-Bloomington, MN-WI Metropolitan Statistical Area","(45.0661679, -93.2006967)","Minneapolis-St. Paul-Bloomington, MN-WI "
152,33500,"Minot, ND Micropolitan Statistical Area","(48.3202346, -101.1979994)","Minot, ND "
153,33540,"Missoula, MT Metropolitan Statistical Area","(47.0272561, -113.8926675)","Missoula, MT "
154,33660,"Mobile, AL Metropolitan Statistical Area","(30.6845669, -88.1965631)","Mobile, AL "
155,33740,"Monroe, LA Metropolitan Statistical Area","(32.6904713, -92.2627866)","Monroe, LA "
156,33860,"Montgomery, AL Metropolitan Statistical Area","(32.3655882, -86.4045134)","Montgomery, AL "
157,33874,"Montgomery County-Bucks County-Chester County, PA Metropolitan Division","(40.169886, -75.313634)","Montgomery County-Bucks County-Chester County, PA "
158,34820,"Myrtle Beach-Conway-North Myrtle Beach, SC-NC Metropolitan Statistical Area","(33.9092627, -78.9766723)","Myrtle Beach-Conway-North Myrtle Beach, SC-NC "
159,34980,"Nashville-Davidson--Murfreesboro--Franklin, TN Metropolitan Statistical Area","(36.1281307, -86.681001)","Nashville-Davidson--Murfreesboro--Franklin, TN "
160,35004,"Nassau County-Suffolk County, NY Metropolitan Division","(40.9057116, -72.8348288)","Nassau County-Suffolk County, NY "
161,35084,"Newark, NJ-PA Metropolitan Division","(40.9761049, -74.7440713)","Newark, NJ-PA "
162,35300,"New Haven-Milford, CT Metropolitan Statistical Area","(41.3497089, -72.9002026)","New Haven-Milford, CT "
163,35380,"New Orleans-Metairie, LA Metropolitan Statistical Area","(30.0686307, -89.9390018)","New Orleans-Metairie, LA "
164,35614,"New York-Jersey City-White Plains, NY-NJ Metropolitan Division","(40.777958, -73.966303)","New York-Jersey City-White Plains, NY-NJ "
165,35644,"New York-White Plains-Wayne, NY-NJ Metropolitan Division","(41.0165028, -73.9328707)","New York-White Plains-Wayne, NY-NJ "
166,35740,"Norfolk, NE Micropolitan Statistical Area","(42.0431228, -97.487943)","Norfolk, NE "
167,35820,"North Platte, NE Micropolitan Statistical Area","(41.2306402, -100.7833111)","North Platte, NE "
168,35840,"North Port-Sarasota-Bradenton, FL Metropolitan Statistical Area","(27.477054, -82.532775)","North Port-Sarasota-Bradenton, FL "
169,35980,"Norwich-New London, CT Metropolitan Statistical Area","(41.5397454592692, -72.0820909072041)","Norwich-New London, CT "
170,36084,"Oakland-Hayward-Berkeley, CA Metropolitan Division","(37.782952, -121.908961)","Oakland-Hayward-Berkeley, CA "
171,36140,"Ocean City, NJ Metropolitan Statistical Area","(39.0861346, -74.8477142)","Ocean City, NJ "
172,36260,"Ogden-Clearfield, UT Metropolitan Statistical Area","(41.1239934, -111.8690195)","Ogden-Clearfield, UT "
173,36420,"Oklahoma City, OK Metropolitan Statistical Area","(35.4295371, -97.5063422)","Oklahoma City, OK "
174,36500,"Olympia-Tumwater, WA Metropolitan Statistical Area","(46.9325923, -122.8294259)","Olympia-Tumwater, WA "
175,36540,"Omaha-Council Bluffs, NE-IA Metropolitan Statistical Area","(41.2904514, -95.9999621)","Omaha-Council Bluffs, NE-IA "
176,36700,"Orangeburg, SC Micropolitan Statistical Area","(33.4361285, -80.80291)","Orangeburg, SC "
177,36740,"Orlando-Kissimmee-Sanford, FL Metropolitan Statistical Area","(28.4343441, -81.3558288)","Orlando-Kissimmee-Sanford, FL "
178,37460,"Panama City, FL Metropolitan Statistical Area","(30.237647, -85.632623)","Panama City, FL "
179,37764,"Peabody, MA Metropolitan Division","(42.6427023, -70.8651068)","Peabody, MA "
180,37860,"Pensacola-Ferry Pass-Brent, FL Metropolitan Statistical Area","(30.659396, -87.156272)","Pensacola-Ferry Pass-Brent, FL "
181,37964,"Philadelphia, PA Metropolitan Division","(40.1272286, -75.411253)","Philadelphia, PA "
182,38060,"Phoenix-Mesa-Scottsdale, AZ Metropolitan Statistical Area","(33.1857602, -112.0678514)","Phoenix-Mesa-Scottsdale, AZ "
183,38180,"Pierre, SD Micropolitan Statistical Area","(44.4048895, -100.4848079)","Pierre, SD "
184,38300,"Pittsburgh, PA Metropolitan Statistical Area","(40.4343404, -79.8280504)","Pittsburgh, PA "
185,38660,"Ponce, PR Metropolitan Statistical Area","(20.464, -67.442)","Ponce, PR "
186,38860,"Portland-South Portland, ME Metropolitan Statistical Area","(43.6514083, -70.418375)","Portland-South Portland, ME "
187,38900,"Portland-Vancouver-Hillsboro, OR-WA Metropolitan Statistical Area","(45.6006149, -122.4843312)","Portland-Vancouver-Hillsboro, OR-WA "
188,38940,"Port St. Lucie, FL Metropolitan Statistical Area","(27.224664, -80.421001)","Port St. Lucie, FL "
189,39300,"Providence-Warwick, RI-MA Metropolitan Statistical Area","(41.7041016, -71.2859559)","Providence-Warwick, RI-MA "
190,39340,"Provo-Orem, UT Metropolitan Statistical Area","(39.8720611, -112.3590475)","Provo-Orem, UT "
191,39580,"Raleigh, NC Metropolitan Statistical Area","(35.7567393, -78.4604386)","Raleigh, NC "
192,39660,"Rapid City, SD Metropolitan Statistical Area","(44.315478, -102.7683731)","Rapid City, SD "
193,39900,"Reno, NV Metropolitan Statistical Area","(40.5011002, -119.7315178)","Reno, NV "
194,40060,"Richmond, VA Metropolitan Statistical Area","(37.5227248, -77.5210138)","Richmond, VA "
195,40140,"Riverside-San Bernardino-Ontario, CA Metropolitan Statistical Area","(34.5375294, -116.1309093)","Riverside-San Bernardino-Ontario, CA "
196,40180,"Riverton, WY Micropolitan Statistical Area","(43.0552968, -108.6055196)","Riverton, WY "
197,40220,"Roanoke, VA Metropolitan Statistical Area","(37.27083, -79.94167)","Roanoke, VA "
198,40340,"Rochester, MN Metropolitan Statistical Area","(44.02602, -92.46053)","Rochester, MN "
199,40380,"Rochester, NY Metropolitan Statistical Area","(43.188512, -77.553937)","Rochester, NY "
200,40484,"Rockingham County-Strafford County, NH Metropolitan Division","(43.0866404, -71.069839)","Rockingham County-Strafford County, NH "
201,40500,"Rockland, ME Micropolitan Statistical Area","(44.0420356, -69.0385145)","Rockland, ME "
202,40860,"Rutland, VT Micropolitan Statistical Area","(43.5808351, -73.0381951)","Rutland, VT "
203,40900,"Sacramento--Roseville--Arden-Arcade, CA Metropolitan Statistical Area","(38.7896728, -121.0057373)","Sacramento--Roseville--Arden-Arcade, CA "
204,41060,"St. Cloud, MN Metropolitan Statistical Area","(45.56707, -94.18301)","St. Cloud, MN "
205,41180,"St. Louis, MO-IL Metropolitan Statistical Area","(38.6694602, -90.395932)","St. Louis, MO-IL "
206,41420,"Salem, OR Metropolitan Statistical Area","(44.9033791, -122.9017427)","Salem, OR "
207,41460,"Salina, KS Micropolitan Statistical Area","(38.84054, -97.6097)","Salina, KS "
208,41540,"Salisbury, MD-DE Metropolitan Statistical Area","(38.371571, -75.595082)","Salisbury, MD-DE "
209,41620,"Salt Lake City, UT Metropolitan Statistical Area","(40.553973, -112.6636578)","Salt Lake City, UT "
210,41700,"San Antonio-New Braunfels, TX Metropolitan Statistical Area","(29.4330549, -98.6069656)","San Antonio-New Braunfels, TX "
211,41740,"San Diego-Carlsbad, CA Metropolitan Statistical Area","(33.0235993, -116.7761055)","San Diego-Carlsbad, CA "
212,41860,"San Francisco-Oakland-Fremont, CA Metropolitan Statistical Area","(37.7737135, -122.2744185)","San Francisco-Oakland-Fremont, CA "
213,41884,"San Francisco-Redwood City-South San Francisco, CA Metropolitan Division","(37.775761, -122.537944)","San Francisco-Redwood City-South San Francisco, CA "
214,41940,"San Jose-Sunnyvale-Santa Clara, CA Metropolitan Statistical Area","(36.9084669, -121.3713591)","San Jose-Sunnyvale-Santa Clara, CA "
215,41980,"San Juan-Carolina-Caguas, PR Metropolitan Statistical Area","(20.778, -67.051)","San Juan-Carolina-Caguas, PR "
216,42044,"Santa Ana-Anaheim-Irvine, CA Metropolitan Division","(33.6756824, -117.7771947)","Santa Ana-Anaheim-Irvine, CA "
217,42140,"Santa Fe, NM Metropolitan Statistical Area","(35.5137249, -105.9664292)","Santa Fe, NM "
218,42380,"Sayre, PA Micropolitan Statistical Area","(41.829722, -76.526197)","Sayre, PA "
219,42420,"Scottsbluff, NE Micropolitan Statistical Area","(41.6992687, -103.7085922)","Scottsbluff, NE "
220,42540,"Scranton--Wilkes-Barre--Hazleton, PA Metropolitan Statistical Area","(41.3228724, -75.8981857)","Scranton--Wilkes-Barre--Hazleton, PA "
221,42580,"Seaford, DE Micropolitan Statistical Area","(38.677503, -75.3354932)","Seaford, DE "
222,42644,"Seattle-Bellevue-Everett, WA Metropolitan Division","(47.7622016, -121.7814971)","Seattle-Bellevue-Everett, WA "
223,43340,"Shreveport-Bossier City, LA Metropolitan Statistical Area","(32.4376764, -93.7448769)","Shreveport-Bossier City, LA "
224,43524,"Silver Spring-Frederick-Rockville, MD Metropolitan Division","(39.086185, -77.122862)","Silver Spring-Frederick-Rockville, MD "
225,43580,"Sioux City, IA-NE-SD Metropolitan Statistical Area","(42.5129343, -96.4389408)","Sioux City, IA-NE-SD "
226,43620,"Sioux Falls, SD Metropolitan Statistical Area","(43.495413, -96.9953301)","Sioux Falls, SD "
